{
  "detector_semantic_id": "ATLAS.DETECTOR.LOCAL_EULER.EVEN_MOMENTS.He72a831d587b0073d1f38ca865fed648",
  "per_prime": [
    {
      "a_p": -2,
      "coefficient_fourth": {
        "denominator": 1,
        "numerator": 4,
        "text": "4"
      },
      "coefficient_square": {
        "denominator": 1,
        "numerator": 2,
        "text": "2"
      },
      "hasse_control": true,
      "inverse_prime_coefficient": "2/sqrt(2)",
      "p": 2,
      "unit_magnitude": false
    },
    {
      "a_p": -1,
      "coefficient_fourth": {
        "denominator": 9,
        "numerator": 1,
        "text": "1/9"
      },
      "coefficient_square": {
        "denominator": 3,
        "numerator": 1,
        "text": "1/3"
      },
      "hasse_control": true,
      "inverse_prime_coefficient": "1/sqrt(3)",
      "p": 3,
      "unit_magnitude": false
    },
    {
      "a_p": 1,
      "coefficient_fourth": {
        "denominator": 25,
        "numerator": 1,
        "text": "1/25"
      },
      "coefficient_square": {
        "denominator": 5,
        "numerator": 1,
        "text": "1/5"
      },
      "hasse_control": true,
      "inverse_prime_coefficient": "-1/sqrt(5)",
      "p": 5,
      "unit_magnitude": false
    },
    {
      "a_p": -2,
      "coefficient_fourth": {
        "denominator": 49,
        "numerator": 16,
        "text": "16/49"
      },
      "coefficient_square": {
        "denominator": 7,
        "numerator": 4,
        "text": "4/7"
      },
      "hasse_control": true,
      "inverse_prime_coefficient": "2/sqrt(7)",
      "p": 7,
      "unit_magnitude": false
    },
    {
      "a_p": 4,
      "coefficient_fourth": {
        "denominator": 169,
        "numerator": 256,
        "text": "256/169"
      },
      "coefficient_square": {
        "denominator": 13,
        "numerator": 16,
        "text": "16/13"
      },
      "hasse_control": true,
      "inverse_prime_coefficient": "-4/sqrt(13)",
      "p": 13,
      "unit_magnitude": false
    },
    {
      "a_p": -2,
      "coefficient_fourth": {
        "denominator": 289,
        "numerator": 16,
        "text": "16/289"
      },
      "coefficient_square": {
        "denominator": 17,
        "numerator": 4,
        "text": "4/17"
      },
      "hasse_control": true,
      "inverse_prime_coefficient": "2/sqrt(17)",
      "p": 17,
      "unit_magnitude": false
    },
    {
      "a_p": 0,
      "coefficient_fourth": {
        "denominator": 1,
        "numerator": 0,
        "text": "0"
      },
      "coefficient_square": {
        "denominator": 1,
        "numerator": 0,
        "text": "0"
      },
      "hasse_control": true,
      "inverse_prime_coefficient": "0",
      "p": 19,
      "unit_magnitude": false
    },
    {
      "a_p": -1,
      "coefficient_fourth": {
        "denominator": 529,
        "numerator": 1,
        "text": "1/529"
      },
      "coefficient_square": {
        "denominator": 23,
        "numerator": 1,
        "text": "1/23"
      },
      "hasse_control": true,
      "inverse_prime_coefficient": "1/sqrt(23)",
      "p": 23,
      "unit_magnitude": false
    },
    {
      "a_p": 0,
      "coefficient_fourth": {
        "denominator": 1,
        "numerator": 0,
        "text": "0"
      },
      "coefficient_square": {
        "denominator": 1,
        "numerator": 0,
        "text": "0"
      },
      "hasse_control": true,
      "inverse_prime_coefficient": "0",
      "p": 29,
      "unit_magnitude": false
    },
    {
      "a_p": 7,
      "coefficient_fourth": {
        "denominator": 961,
        "numerator": 2401,
        "text": "2401/961"
      },
      "coefficient_square": {
        "denominator": 31,
        "numerator": 49,
        "text": "49/31"
      },
      "hasse_control": true,
      "inverse_prime_coefficient": "-7/sqrt(31)",
      "p": 31,
      "unit_magnitude": false
    },
    {
      "a_p": 3,
      "coefficient_fourth": {
        "denominator": 1369,
        "numerator": 81,
        "text": "81/1369"
      },
      "coefficient_square": {
        "denominator": 37,
        "numerator": 9,
        "text": "9/37"
      },
      "hasse_control": true,
      "inverse_prime_coefficient": "-3/sqrt(37)",
      "p": 37,
      "unit_magnitude": false
    },
    {
      "a_p": -8,
      "coefficient_fourth": {
        "denominator": 1681,
        "numerator": 4096,
        "text": "4096/1681"
      },
      "coefficient_square": {
        "denominator": 41,
        "numerator": 64,
        "text": "64/41"
      },
      "hasse_control": true,
      "inverse_prime_coefficient": "8/sqrt(41)",
      "p": 41,
      "unit_magnitude": false
    },
    {
      "a_p": -6,
      "coefficient_fourth": {
        "denominator": 1849,
        "numerator": 1296,
        "text": "1296/1849"
      },
      "coefficient_square": {
        "denominator": 43,
        "numerator": 36,
        "text": "36/43"
      },
      "hasse_control": true,
      "inverse_prime_coefficient": "6/sqrt(43)",
      "p": 43,
      "unit_magnitude": false
    }
  ],
  "schema_version": "riemann.atlas.raw.local_euler_result.v1",
  "subject_semantic_id": "ATLAS.LFUNC.EC.11.R0.H640f9f7ea45725183495b7b2525cf21c",
  "summary": {
    "hasse_control": true,
    "mean_fourth": {
      "denominator": 15142362203798364929591925,
      "numerator": 13680377587284913295751529,
      "text": "13680377587284913295751529/15142362203798364929591925"
    },
    "mean_square": {
      "denominator": 14030349555495,
      "numerator": 9536727364483,
      "text": "9536727364483/14030349555495"
    },
    "naive_prime_coefficient_unit_magnitude": false,
    "prime_count": 13,
    "sign_counts": {
      "negative": 4,
      "positive": 7,
      "zero": 2
    },
    "unitary_top_coefficient_control": true,
    "unitary_top_coefficient_modulus_squared": "1"
  }
}
